{
  "schema_version": "1.2.0",
  "bundle_id": "plains_rolling_vernon_evidence",
  "generated_at": "2026-08-29T04:00:40.070399+00:00",
  "status": "validated",
  "location": {
    "farm_id": "plains_rolling_vernon",
    "farm_name": "Rolling Plains — Vernon",
    "latitude": 34.12,
    "longitude": -99.32,
    "texas_region_id": "plains",
    "timezone": "America/Chicago"
  },
  "catalog": {
    "version": "1.1.0",
    "crop_count": 22,
    "crop_ids": [
      "upland_cotton",
      "corn_grain",
      "hard_red_winter_wheat",
      "grain_sorghum",
      "runner_peanut",
      "long_grain_rice",
      "soybean",
      "grain_oats",
      "oilseed_sunflower",
      "sesame",
      "corn_silage",
      "forage_sorghum",
      "sorghum_sudangrass",
      "alfalfa_hay",
      "bermudagrass_hay",
      "annual_ryegrass_forage",
      "white_potato",
      "sweet_potato",
      "seedless_watermelon",
      "dry_bulb_onion",
      "fresh_market_cabbage",
      "fresh_market_spinach"
    ],
    "source_path": "data/crop-catalog/catalog.json"
  },
  "provenance": {
    "fortyguard": {
      "provider": "FortyGuard Temperature API",
      "source_path": "data/evidence/regions/plains_rolling_vernon/fortyguard.json",
      "generated_at": "2026-08-28T14:56:23.989736+00:00",
      "evidence_role": "farm-scale spatial heat exposure across 1 validated time window(s)",
      "location_match": true,
      "freshness": {
        "basis": "artifact_generated_at",
        "age_hours": 13.071,
        "max_age_hours": 168,
        "status": "fresh",
        "passed": true
      },
      "source_data_vintage": "2026-08-21 through 2026-08-27"
    },
    "nasa_power": {
      "provider": "NASA POWER",
      "source_path": "data/evidence/regions/plains_rolling_vernon/nasa_power.json",
      "generated_at": "2026-08-28T14:56:23.986734+00:00",
      "evidence_role": "long_term_climate_baseline_and_daily_history",
      "location_match": true,
      "freshness": {
        "basis": "artifact_generated_at",
        "age_hours": 13.071,
        "max_age_hours": 720,
        "status": "fresh",
        "passed": true
      },
      "source_data_vintage": "2001-2020 climatology and 2025 daily history"
    },
    "open_meteo": {
      "provider": "Open-Meteo",
      "source_path": "data/evidence/regions/plains_rolling_vernon/open_meteo.json",
      "generated_at": "2026-08-28T14:56:23.987738+00:00",
      "evidence_role": "recent_and_forecast_weather",
      "location_match": true,
      "freshness": {
        "basis": "artifact_generated_at",
        "age_hours": 13.071,
        "max_age_hours": 48,
        "status": "fresh",
        "passed": true
      },
      "source_data_vintage": "2026-08-28T09:45"
    },
    "ssurgo": {
      "provider": "USDA NRCS SSURGO via Soil Data Access",
      "source_path": "data/evidence/regions/plains_rolling_vernon/ssurgo.json",
      "generated_at": "2026-08-28T14:56:23.987738+00:00",
      "evidence_role": "mapped permanent soil properties and available-water storage capacity",
      "location_match": true,
      "freshness": {
        "basis": "artifact_generated_at",
        "age_hours": 13.071,
        "max_age_hours": 8760,
        "status": "fresh",
        "passed": true
      },
      "source_data_vintage": "9/5/2025 12:09:23 PM"
    }
  },
  "units": {
    "air_temperature": "degC",
    "precipitation": "mm",
    "relative_humidity": "percent",
    "wind_speed": "m/s",
    "solar_radiation": "MJ/m^2/day",
    "photosynthetically_active_radiation": "MJ/m^2/day",
    "soil_temperature": "degC",
    "volumetric_soil_moisture": "m^3/m^3",
    "available_water_storage": "mm",
    "depth": "cm",
    "heat_exposure": "hour",
    "ph": "dimensionless"
  },
  "location_evidence": {
    "fortyguard_heat": {
      "granularity_m": 100,
      "tile_count_per_response": 70,
      "total_validated_responses": 13,
      "total_null_values": 0,
      "windows": [
        {
          "window_name": "one_week",
          "window_days": 7,
          "start_date": "2026-08-21",
          "end_date": "2026-08-27",
          "tile_count": 70,
          "mean_temperature_c": 33.244505714285715,
          "minimum_tile_average_temperature_c": 33.2444,
          "maximum_tile_average_temperature_c": 33.2446,
          "period_minimum_temperature_c": 24.1289,
          "period_maximum_temperature_c": 41.15,
          "peak_hour_raw": null,
          "peak_hour_timezone_status": "not_collected_for_mvp"
        }
      ],
      "interpretation_warning": "Peak-hour values remain raw because the FortyGuard response timezone is unverified; do not label them as local time until the provider confirms the basis."
    },
    "nasa_power_climate": {
      "history_start_date": "2025-01-01",
      "history_end_date": "2025-12-31",
      "climatology_period": "January 2001 - December 2020",
      "annual_summary": {
        "mean_temperature_c": 18.43,
        "highest_temperature_c": 39.8,
        "lowest_temperature_c": -12.62,
        "annual_precipitation_mm": 721.05,
        "mean_relative_humidity_percent": 59.38,
        "mean_wind_speed_m_s": 3.03,
        "mean_solar_radiation_mj_m2_day": 18.22,
        "mean_par_mj_m2_day": 8.33,
        "mean_root_zone_wetness": 0.4,
        "mean_vpd_kpa": 1.05,
        "gdd_base_10": 3670.23,
        "heat_stress_days_above_35c": 60.0
      },
      "monthly_summary": [
        {
          "month": "Jan",
          "T2M": 2.982258,
          "T2M_MAX": 21.72,
          "T2M_MIN": -7.75,
          "PRECIPITATION_TOTAL_MM": 11.57,
          "RH2M": 61.682258,
          "ALLSKY_SFC_SW_DWN": 11.806129,
          "WS2M": 3.015484,
          "T2MDEW": -4.309355,
          "ALLSKY_SFC_PAR_TOT": 5.122903,
          "GWETROOT": 0.412903,
          "EVPTRNS_TOTAL_MJ_M2": 4.21,
          "VPD_KPA": 0.305031,
          "GDD_BASE_10": 7.065,
          "HEAT_STRESS_DAY_35C": 0
        },
        {
          "month": "Feb",
          "T2M": 5.658214,
          "T2M_MAX": 28.96,
          "T2M_MIN": -12.62,
          "PRECIPITATION_TOTAL_MM": 2.68,
          "RH2M": 59.871429,
          "ALLSKY_SFC_SW_DWN": 13.678929,
          "WS2M": 3.069286,
          "T2MDEW": -2.369643,
          "ALLSKY_SFC_PAR_TOT": 6.038571,
          "GWETROOT": 0.398929,
          "EVPTRNS_TOTAL_MJ_M2": 12.36,
          "VPD_KPA": 0.441565,
          "GDD_BASE_10": 38.175,
          "HEAT_STRESS_DAY_35C": 0
        },
        {
          "month": "Mar",
          "T2M": 15.08,
          "T2M_MAX": 32.36,
          "T2M_MIN": 0.53,
          "PRECIPITATION_TOTAL_MM": 37.41,
          "RH2M": 48.491935,
          "ALLSKY_SFC_SW_DWN": 19.185484,
          "WS2M": 3.775484,
          "T2MDEW": 2.733226,
          "ALLSKY_SFC_PAR_TOT": 8.512258,
          "GWETROOT": 0.393871,
          "EVPTRNS_TOTAL_MJ_M2": 42.21,
          "VPD_KPA": 0.975454,
          "GDD_BASE_10": 169.17,
          "HEAT_STRESS_DAY_35C": 0
        },
        {
          "month": "Apr",
          "T2M": 18.53,
          "T2M_MAX": 35.9,
          "T2M_MIN": 1.16,
          "PRECIPITATION_TOTAL_MM": 254.48,
          "RH2M": 62.360333,
          "ALLSKY_SFC_SW_DWN": 19.37,
          "WS2M": 3.575667,
          "T2MDEW": 9.877333,
          "ALLSKY_SFC_PAR_TOT": 8.824667,
          "GWETROOT": 0.441667,
          "EVPTRNS_TOTAL_MJ_M2": 85.35,
          "VPD_KPA": 0.884277,
          "GDD_BASE_10": 266.035,
          "HEAT_STRESS_DAY_35C": 2
        },
        {
          "month": "May",
          "T2M": 21.827097,
          "T2M_MAX": 36.75,
          "T2M_MIN": 7.89,
          "PRECIPITATION_TOTAL_MM": 98.06,
          "RH2M": 66.745484,
          "ALLSKY_SFC_SW_DWN": 23.341613,
          "WS2M": 2.703226,
          "T2MDEW": 14.388065,
          "ALLSKY_SFC_PAR_TOT": 10.684194,
          "GWETROOT": 0.48,
          "EVPTRNS_TOTAL_MJ_M2": 173.89,
          "VPD_KPA": 0.990968,
          "GDD_BASE_10": 368.995,
          "HEAT_STRESS_DAY_35C": 4
        },
        {
          "month": "Jun",
          "T2M": 27.333,
          "T2M_MAX": 36.92,
          "T2M_MIN": 14.71,
          "PRECIPITATION_TOTAL_MM": 112.7,
          "RH2M": 68.789667,
          "ALLSKY_SFC_SW_DWN": 24.920333,
          "WS2M": 3.210333,
          "T2MDEW": 20.528,
          "ALLSKY_SFC_PAR_TOT": 11.769667,
          "GWETROOT": 0.437667,
          "EVPTRNS_TOTAL_MJ_M2": 161.39,
          "VPD_KPA": 1.232988,
          "GDD_BASE_10": 523.81,
          "HEAT_STRESS_DAY_35C": 8
        },
        {
          "month": "Jul",
          "T2M": 29.550968,
          "T2M_MAX": 39.8,
          "T2M_MIN": 21.61,
          "PRECIPITATION_TOTAL_MM": 34.51,
          "RH2M": 60.024839,
          "ALLSKY_SFC_SW_DWN": 24.640645,
          "WS2M": 3.085161,
          "T2MDEW": 20.103548,
          "ALLSKY_SFC_PAR_TOT": 11.615806,
          "GWETROOT": 0.397419,
          "EVPTRNS_TOTAL_MJ_M2": 109.83,
          "VPD_KPA": 1.796511,
          "GDD_BASE_10": 609.185,
          "HEAT_STRESS_DAY_35C": 17
        },
        {
          "month": "Aug",
          "T2M": 29.005161,
          "T2M_MAX": 39.76,
          "T2M_MIN": 19.29,
          "PRECIPITATION_TOTAL_MM": 83.87,
          "RH2M": 60.350645,
          "ALLSKY_SFC_SW_DWN": 22.092903,
          "WS2M": 2.685161,
          "T2MDEW": 19.695161,
          "ALLSKY_SFC_PAR_TOT": 10.343871,
          "GWETROOT": 0.386452,
          "EVPTRNS_TOTAL_MJ_M2": 95.59,
          "VPD_KPA": 1.730399,
          "GDD_BASE_10": 599.515,
          "HEAT_STRESS_DAY_35C": 18
        },
        {
          "month": "Sep",
          "T2M": 26.063333,
          "T2M_MAX": 38.21,
          "T2M_MIN": 15.07,
          "PRECIPITATION_TOTAL_MM": 33.83,
          "RH2M": 53.658333,
          "ALLSKY_SFC_SW_DWN": 19.949,
          "WS2M": 2.578333,
          "T2MDEW": 15.110333,
          "ALLSKY_SFC_PAR_TOT": 9.249,
          "GWETROOT": 0.373,
          "EVPTRNS_TOTAL_MJ_M2": 48.78,
          "VPD_KPA": 1.66753,
          "GDD_BASE_10": 492.345,